{
  "authority": "coarse_model_range_pilot_only",
  "campaign": "pattern-bosch-range-pilot-v1",
  "cases": [
    {
      "campaign": "pattern-bosch-range-pilot-v1",
      "case_id": "03e4462cc40f402c",
      "coded_levels": [
        0,
        1,
        1,
        1,
        1,
        1,
        1,
        1,
        1,
        1,
        1,
        1
      ],
      "derived_exposures": {
        "total_cycle_etch_duration": 32.0,
        "total_etch_duration_including_open": 32.5,
        "total_polymer_deposition_amount": 0.64,
        "total_polymer_directional_removal_amount": -0.64
      },
      "design_row": 0,
      "numerics": {
        "grid_delta": 0.01,
        "rays_per_point": 250
      },
      "recipe": {
        "deposition_sticking_probability": 0.03,
        "deposition_thickness": 0.04,
        "etch_time": 2.0,
        "initial_etch_time": 0.5,
        "ion_rate": -0.04,
        "ion_source_exponent": 1000.0,
        "mask_taper": 6.0,
        "neutral_rate": -0.03,
        "neutral_sticking_probability": 0.3,
        "num_cycles": 16,
        "radius": 0.15,
        "theta_r_min": 90.0
      },
      "rng_seed": 1420000
    },
    {
      "campaign": "pattern-bosch-range-pilot-v1",
      "case_id": "1bc9ee67d8de6702",
      "coded_levels": [
        -1,
        0,
        1,
        -1,
        1,
        1,
        1,
        -1,
        -1,
        -1,
        1,
        -1
      ],
      "derived_exposures": {
        "total_cycle_etch_duration": 3.2,
        "total_etch_duration_including_open": 3.7,
        "total_polymer_deposition_amount": 0.048,
        "total_polymer_directional_removal_amount": -0.048
      },
      "design_row": 1,
      "numerics": {
        "grid_delta": 0.01,
        "rays_per_point": 250
      },
      "recipe": {
        "deposition_sticking_probability": 0.001,
        "deposition_thickness": 0.003,
        "etch_time": 0.2,
        "initial_etch_time": 0.5,
        "ion_rate": -0.22,
        "ion_source_exponent": 50.0,
        "mask_taper": 2.0,
        "neutral_rate": -0.03,
        "neutral_sticking_probability": 0.3,
        "num_cycles": 16,
        "radius": 0.12,
        "theta_r_min": 90.0
      },
      "rng_seed": 1420000
    },
    {
      "campaign": "pattern-bosch-range-pilot-v1",
      "case_id": "d16d25d515597c4e",
      "coded_levels": [
        -1,
        -1,
        0,
        1,
        -1,
        1,
        1,
        1,
        -1,
        -1,
        -1,
        1
      ],
      "derived_exposures": {
        "total_cycle_etch_duration": 20.0,
        "total_etch_duration_including_open": 20.1,
        "total_polymer_deposition_amount": 0.4,
        "total_polymer_directional_removal_amount": -0.4
      },
      "design_row": 2,
      "numerics": {
        "grid_delta": 0.01,
        "rays_per_point": 250
      },
      "recipe": {
        "deposition_sticking_probability": 0.001,
        "deposition_thickness": 0.04,
        "etch_time": 2.0,
        "initial_etch_time": 0.1,
        "ion_rate": -0.04,
        "ion_source_exponent": 50.0,
        "mask_taper": -4.0,
        "neutral_rate": -0.03,
        "neutral_sticking_probability": 0.3,
        "num_cycles": 10,
        "radius": 0.12,
        "theta_r_min": 25.0
      },
      "rng_seed": 1420000
    },
    {
      "campaign": "pattern-bosch-range-pilot-v1",
      "case_id": "5e9804389daa118a",
      "coded_levels": [
        -1,
        1,
        -1,
        0,
        1,
        -1,
        1,
        1,
        1,
        -1,
        -1,
        -1
      ],
      "derived_exposures": {
        "total_cycle_etch_duration": 2.0,
        "total_etch_duration_including_open": 2.5,
        "total_polymer_deposition_amount": 0.16,
        "total_polymer_directional_removal_amount": -0.16
      },
      "design_row": 3,
      "numerics": {
        "grid_delta": 0.01,
        "rays_per_point": 250
      },
      "recipe": {
        "deposition_sticking_probability": 0.03,
        "deposition_thickness": 0.04,
        "etch_time": 0.5,
        "initial_etch_time": 0.5,
        "ion_rate": -0.22,
        "ion_source_exponent": 50.0,
        "mask_taper": 6.0,
        "neutral_rate": -0.2,
        "neutral_sticking_probability": 0.3,
        "num_cycles": 4,
        "radius": 0.12,
        "theta_r_min": 25.0
      },
      "rng_seed": 1420000
    },
    {
      "campaign": "pattern-bosch-range-pilot-v1",
      "case_id": "bd5b486f6fb67256",
      "coded_levels": [
        -1,
        -1,
        1,
        -1,
        0,
        1,
        -1,
        1,
        1,
        1,
        -1,
        -1
      ],
      "derived_exposures": {
        "total_cycle_etch_duration": 3.2,
        "total_etch_duration_including_open": 3.5,
        "total_polymer_deposition_amount": 0.64,
        "total_polymer_directional_removal_amount": -0.64
      },
      "design_row": 4,
      "numerics": {
        "grid_delta": 0.01,
        "rays_per_point": 250
      },
      "recipe": {
        "deposition_sticking_probability": 0.03,
        "deposition_thickness": 0.04,
        "etch_time": 0.2,
        "initial_etch_time": 0.3,
        "ion_rate": -0.22,
        "ion_source_exponent": 1000.0,
        "mask_taper": -4.0,
        "neutral_rate": -0.03,
        "neutral_sticking_probability": 0.02,
        "num_cycles": 16,
        "radius": 0.12,
        "theta_r_min": 25.0
      },
      "rng_seed": 1420000
    },
    {
      "campaign": "pattern-bosch-range-pilot-v1",
      "case_id": "7d8102bf6ea2fd39",
      "coded_levels": [
        -1,
        -1,
        -1,
        1,
        -1,
        0,
        1,
        -1,
        1,
        1,
        1,
        -1
      ],
      "derived_exposures": {
        "total_cycle_etch_duration": 8.0,
        "total_etch_duration_including_open": 8.1,
        "total_polymer_deposition_amount": 0.012,
        "total_polymer_directional_removal_amount": -0.012
      },
      "design_row": 5,
      "numerics": {
        "grid_delta": 0.01,
        "rays_per_point": 250
      },
      "recipe": {
        "deposition_sticking_probability": 0.03,
        "deposition_thickness": 0.003,
        "etch_time": 2.0,
        "initial_etch_time": 0.1,
        "ion_rate": -0.22,
        "ion_source_exponent": 1000.0,
        "mask_taper": -4.0,
        "neutral_rate": -0.08,
        "neutral_sticking_probability": 0.3,
        "num_cycles": 4,
        "radius": 0.12,
        "theta_r_min": 90.0
      },
      "rng_seed": 1420000
    },
    {
      "campaign": "pattern-bosch-range-pilot-v1",
      "case_id": "5d810798108e9257",
      "coded_levels": [
        -1,
        -1,
        -1,
        -1,
        1,
        -1,
        0,
        1,
        -1,
        1,
        1,
        1
      ],
      "derived_exposures": {
        "total_cycle_etch_duration": 0.8,
        "total_etch_duration_including_open": 1.3,
        "total_polymer_deposition_amount": 0.16,
        "total_polymer_directional_removal_amount": -0.16
      },
      "design_row": 6,
      "numerics": {
        "grid_delta": 0.01,
        "rays_per_point": 250
      },
      "recipe": {
        "deposition_sticking_probability": 0.001,
        "deposition_thickness": 0.04,
        "etch_time": 0.2,
        "initial_etch_time": 0.5,
        "ion_rate": -0.04,
        "ion_source_exponent": 1000.0,
        "mask_taper": -4.0,
        "neutral_rate": -0.2,
        "neutral_sticking_probability": 0.08,
        "num_cycles": 4,
        "radius": 0.12,
        "theta_r_min": 90.0
      },
      "rng_seed": 1420000
    },
    {
      "campaign": "pattern-bosch-range-pilot-v1",
      "case_id": "f56ee9f0c5703348",
      "coded_levels": [
        -1,
        1,
        -1,
        -1,
        -1,
        1,
        -1,
        0,
        1,
        -1,
        1,
        1
      ],
      "derived_exposures": {
        "total_cycle_etch_duration": 0.8,
        "total_etch_duration_including_open": 0.9,
        "total_polymer_deposition_amount": 0.02,
        "total_polymer_directional_removal_amount": -0.02
      },
      "design_row": 7,
      "numerics": {
        "grid_delta": 0.01,
        "rays_per_point": 250
      },
      "recipe": {
        "deposition_sticking_probability": 0.03,
        "deposition_thickness": 0.005,
        "etch_time": 0.2,
        "initial_etch_time": 0.1,
        "ion_rate": -0.04,
        "ion_source_exponent": 50.0,
        "mask_taper": 6.0,
        "neutral_rate": -0.03,
        "neutral_sticking_probability": 0.02,
        "num_cycles": 4,
        "radius": 0.12,
        "theta_r_min": 90.0
      },
      "rng_seed": 1420000
    },
    {
      "campaign": "pattern-bosch-range-pilot-v1",
      "case_id": "b7dfbfd920d001d9",
      "coded_levels": [
        -1,
        1,
        1,
        -1,
        -1,
        -1,
        1,
        -1,
        0,
        1,
        -1,
        1
      ],
      "derived_exposures": {
        "total_cycle_etch_duration": 3.2,
        "total_etch_duration_including_open": 3.3000000000000003,
        "total_polymer_deposition_amount": 0.048,
        "total_polymer_directional_removal_amount": -0.048
      },
      "design_row": 8,
      "numerics": {
        "grid_delta": 0.01,
        "rays_per_point": 250
      },
      "recipe": {
        "deposition_sticking_probability": 0.01,
        "deposition_thickness": 0.003,
        "etch_time": 0.2,
        "initial_etch_time": 0.1,
        "ion_rate": -0.04,
        "ion_source_exponent": 1000.0,
        "mask_taper": 6.0,
        "neutral_rate": -0.2,
        "neutral_sticking_probability": 0.3,
        "num_cycles": 16,
        "radius": 0.12,
        "theta_r_min": 25.0
      },
      "rng_seed": 1420000
    },
    {
      "campaign": "pattern-bosch-range-pilot-v1",
      "case_id": "a0b1a42f034be0b4",
      "coded_levels": [
        -1,
        1,
        1,
        1,
        -1,
        -1,
        -1,
        1,
        -1,
        0,
        1,
        -1
      ],